Symbol,Company Name,Listed Shares,Paidup Value,Total Paidup
AHPC,Arun Valley Hydropower Development Co. Ltd.,"18,679,626",100.00,"1,867,962,600.00"
BPCL,Butwal Power Company Limited,"34,086,432",100.00,"3,408,643,072.00"
CHCL,Chilime Hydropower Company Limited,"72,581,792",100.00,"7,258,179,584.00"
NHPC,National Hydro Power Company Limited,"16,417,919",100.00,"1,641,791,872.00"
SHPC,Sanima Mai Hydropower Ltd.,"30,892,510",100.00,"3,089,251,000.00"
HURJA,Himalaya Urja Bikas Company Limited,"9,900,000",100.00,"990,000,000.00"
AKPL,Arun Kabeli Power Ltd.,"20,407,316",100.00,"2,040,731,600.00"
BARUN,Barun Hydropower Co. Ltd.,"5,358,150",100.00,"535,815,000.00"
API,Api Power Company Ltd.,"41,332,842",100.00,"4,133,284,200.00"
NGPL,Ngadi Group Power Ltd.,"18,512,792",100.00,"1,851,279,200.00"
MHL,Mandakini Hydropower Limited,"5,880,369",100.00,"588,036,900.00"
NYADI,Nyadi Hydropower Limited,"15,000,000",100.00,"1,500,000,000.00"
SJCL,SANJEN JALAVIDHYUT COMPANY LIMITED,"32,850,000",100.00,"3,285,000,000.00"
RHPL,RASUWAGADHI HYDROPOWER COMPANY LIMITED,"61,578,900",100.00,"6,157,890,000.00"
UMHL,United Modi Hydropower Ltd.,"11,500,000",100.00,"1,150,000,000.00"
DORDI,Dordi Khola Jal Bidyut Company Limited,"10,542,604",100.00,"1,054,260,400.00"
PHCL,Peoples Hydropower Company Limited,"32,000,000",100.00,"3,200,000,000.00"
PPL,People's Power Limited,"6,326,000",100.00,"632,600,000.00"
UPCL,UNIVERSAL POWER COMPANY LTD,"21,003,500",100.00,"2,100,350,000.00"
SPL,Shuvam Power Company Limited,"2,000,000",100.00,"200,000,000.00"
SPDL,Synergy Power Development Ltd.,"8,065,750",100.00,"806,574,976.00"
MKJC,Mailung Khola Jal Vidhyut Company  Limited,"3,681,430",100.00,"368,143,000.00"
SAHAS,Sahas Urja Limited,"35,000,000",100.00,"3,500,000,000.00"
KKHC,Khanikhola Hydropower Co. Ltd.,"4,657,143",100.00,"465,714,300.00"
HPPL,Himalayan Power Partner Ltd.,"10,654,170",100.00,"1,065,417,000.00"
DHPL,Dibyashwori Hydropower Ltd.,"2,640,000",100.00,"264,000,000.00"
BHPL,Barahi Hydropower Public Limited,"2,500,000",100.00,"250,000,000.00"
MHNL,Mountain Hydro Nepal Limited,"12,500,000",100.00,"1,250,000,000.00"
CHL,Chhyangdi Hydropower Ltd.,"3,869,775",100.00,"386,977,500.00"
USHL,Upper Syange  Hydropower Limited,"2,200,000",100.00,"220,000,000.00"
SPHL,Sayapatri Hydropower Limited,"900,000",0.00,"300,000,000.00"
NHDL,Nepal Hydro Developers Ltd.,"3,359,265",100.00,"335,926,496.00"
RADHI,Radhi Bidyut Company Ltd,"16,759,799",100.00,"1,675,979,900.00"
BNHC,Buddhabhumi Nepal Hydropower Company Limited,"4,000,000",100.00,"400,000,000.00"
RHGCL,Rapti Hydro and General Construction Limited,"6,127,938",100.00,"612,793,792.00"
KPCL,Kalika power Company Ltd,"7,935,000",100.00,"793,500,000.00"
TAMOR,Sanima Middle Tamor Hydropower Limited,"33,325,000",100.00,"3,332,500,000.00"
GHL,Ghalemdi Hydro Limited,"5,500,000",100.00,"550,000,000.00"
EHPL,Eastern Hydropower Limited,"6,200,000",100.00,"620,000,000.00"
MKHC,Maya Khola Hydropower Company Limited,"10,000,000",100.00,"1,000,000,000.00"
BEDC,Bhugol Energy Development Company Limited,"5,440,534",100.00,"544,053,400.00"
PMHPL,Panchakanya Mai Hydropower Ltd,"11,000,000",100.00,"1,100,000,000.00"
KBSH,Kutheli Bukhari Small Hydropower Limited,"1,218,657",100.00,"121,865,700.00"
MBJC,Madhya Bhotekoshi Jalavidyut Company Limited,"60,000,000",100.00,"6,000,000,000.00"
GLH,Greenlife Hydropower Limited,"18,000,000",100.00,"1,800,000,000.00"
USHEC,Upper Solu Hydro Electric Company Limited,"13,500,000",100.00,"1,350,000,000.00"
AKJCL,Ankhu Khola Jalvidhyut Company Ltd,"8,000,000",100.00,"800,000,000.00"
LEC,Liberty Energy Company Limited,"15,000,000",100.00,"1,500,000,000.00"
TPC,Terhathum Power Company Limited,"4,000,000",100.00,"400,000,000.00"
SHEL,Singati Hydro Energy Limited,"14,500,000",100.00,"1,450,000,000.00"
PPCL,Panchthar Power Company Limited,"9,625,000",100.00,"962,500,000.00"
TSHL,Three Star Hydropower Limited,"4,925,000",100.00,"492,500,000.00"
SSHL,Shiva Shree Hydropower Limited,"14,764,000",100.00,"1,476,400,000.00"
JOSHI,Joshi Hydropower Development Company Ltd,"3,714,000",100.00,"371,400,000.00"
UPPER,Upper Tamakoshi Hydropower Ltd,"105,900,000",100.00,"10,590,000,000.00"
TVCL,Trishuli Jal Vidhyut Company Limited,"18,525,000",100.00,"1,852,500,000.00"
UNHPL,Union Hydropower Limited,"7,500,000",100.00,"750,000,000.00"
SPC,Samling Power Company Limited,"5,000,000",100.00,"500,000,000.00"
SGHC,Swet-Ganga Hydropower & Construction Limited,"15,930,000",100.00,"1,592,999,936.00"
AHL,Asian Hydropower Limited,"3,400,000",100.00,"340,000,000.00"
BHDC,Bindyabasini Hydropower Development Company Limited,"10,000,000",100.00,"1,000,000,000.00"
HDHPC,Himal Dolakha Hydropower Company Limited,"16,000,000",100.00,"1,600,000,000.00"
MHCL,Molung Hydropower Company Limited,"8,025,000",100.00,"802,500,000.00"
SMH,Super Mai Hydropower Limited,"5,000,000",100.00,"500,000,000.00"
RFPL,River Falls Power Limited,"7,000,000",100.00,"700,000,000.00"
MEN,Mountain Energy Nepal Limited,"19,680,270",100.00,"1,968,027,000.00"
UHEWA,Upper Hewakhola Hydropower Company Limited,"5,000,000",100.00,"500,000,000.00"
HHL,Himalayan Hydropower Limited,"10,950,000",100.00,"1,095,000,000.00"
UMRH,United IDI Mardi RB Hydropower Limited.,"4,200,000",100.00,"420,000,000.00"
SIKLES,Sikles Hydropower Limited,"8,500,000",100.00,"850,000,000.00"
MEL,Modi Energy Limited,"29,000,000",100.00,"2,900,000,000.00"
RURU,Ru Ru Jalbidhyut Pariyojana Limited,"4,933,237",100.00,"493,323,712.00"
MAKAR,Makar Jitumaya Suri Hydropower Limited,"7,600,000",100.00,"760,000,000.00"
SMJC,Sagarmatha Jalabidhyut Company Limited,"11,200,000",100.00,"1,120,000,000.00"
MKHL,Mai Khola Hydropower Limited,"3,921,568",100.00,"392,156,800.00"
CKHL,Chirkhwa Hydropower Limited,"4,000,000",100.00,"400,000,000.00"
MMKJL,Mathillo Mailun Khola Jalvidhyut Limited,"10,000,000",100.00,"1,000,000,000.00"
DOLTI,Dolti Power Company Limited,"5,364,860",100.00,"536,486,000.00"
BHL,Balephi Hydropower Limited,"18,279,700",100.00,"1,827,970,000.00"
GVL,Green Ventures Limited,"3,125,000",100.00,"3,124,999,936.00"
MSHL,Mid-Solu Hydropower Limited,"7,484,000",100.00,"748,400,000.00"
RIDI,Ridi Power Company Limited,"15,489,012",100.00,"1,548,901,200.00"
MEHL,Manakamana Engineering Hydropower Limited,"8,000,000",100.00,"800,000,000.00"
IHL,Ingwa Hydropower Limited,"6,000,000",100.00,"600,000,000.00"
SMHL,Super Madi Hydropower Limited,"21,000,000",100.00,"2,100,000,000.00"
MCHL,Menchhiyam Hydropower Limited,"5,425,833",100.00,"542,583,300.00"
SANVI,Sanvi Energy Limited,"8,800,000",100.00,"880,000,000.00"
RAWA,Rawa Energy Development Limited,"2,800,000",100.00,"280,000,000.00"
ULHC,Upper Lohore Khola Hydropower Company Limited,"5,098,040",100.00,"509,804,000.00"
BGWT,Bhagawati Hydropower Development Company Ltd.,"5,720,647",100.00,"572,064,700.00"
MANDU,Mandu Hydropower Ltd.,"13,636,370",100.00,"1,363,637,000.00"
VLUCL,Vision Lumbini Urja Company Limited,"19,125,000",100.00,"1,912,500,000.00"
